{"event":{"statement":"A supplier announced an API sunset.","confidence":"high","source":"supplier notice"},"impacts":[{"statement":"Clients using v1 must migrate.","confidence":0.9}],"scenarios":[{"statement":"Migration completes before sunset."},{"statement":"Migration slips and requires a compatibility bridge."}],"adaptations":[{"statement":"Build migration tests and a temporary bridge."}],"decision":{"statement":"Begin migration now and retain a rollback path.","status":"decided"},"provenance":{"sdk":"0.1.0"}}
